[
  {
    "userId": "usr_demo_0001",
    "dateTime": "2026-01-06T14:00:00+01:00",
    "category": "movement",
    "itemId": "ses_mov_0007",
    "status": "done",
    "score": 100
  },
  {
    "userId": "usr_demo_0001",
    "dateTime": "2026-01-06T14:15:00+01:00",
    "category": "breath",
    "itemId": "ses_bre_0001",
    "status": "done",
    "score": 100
  },
  {
    "userId": "usr_demo_0001",
    "dateTime": "2026-01-06T20:00:00+01:00",
    "category": "hydration",
    "status": "partial",
    "score": 64,
    "notes": "1.6L sur 2.5L"
  }
]